{
  "source": "strip.webp",
  "width": 800,
  "height": 8010,
  "model": "gutter-fallback",
  "config_hash": "fallback",
  "input_hash": "fallback",
  "provenance": "fallback",
  "characters": [],
  "entries": [
    {
      "panel_index": 1,
      "y_start": 0,
      "y_end": 1599,
      "narration": "",
      "dialogue": "",
      "panel_type": "unknown",
      "confidence": 0.0,
      "bubble_boxes": []
    },
    {
      "panel_index": 2,
      "y_start": 1599,
      "y_end": 1642,
      "narration": "",
      "dialogue": "",
      "panel_type": "unknown",
      "confidence": 0.0,
      "bubble_boxes": []
    },
    {
      "panel_index": 3,
      "y_start": 1642,
      "y_end": 1728,
      "narration": "",
      "dialogue": "",
      "panel_type": "unknown",
      "confidence": 0.0,
      "bubble_boxes": []
    },
    {
      "panel_index": 4,
      "y_start": 1728,
      "y_end": 2266,
      "narration": "",
      "dialogue": "",
      "panel_type": "unknown",
      "confidence": 0.0,
      "bubble_boxes": []
    },
    {
      "panel_index": 5,
      "y_start": 2266,
      "y_end": 2297,
      "narration": "",
      "dialogue": "",
      "panel_type": "unknown",
      "confidence": 0.0,
      "bubble_boxes": []
    },
    {
      "panel_index": 6,
      "y_start": 2297,
      "y_end": 2312,
      "narration": "",
      "dialogue": "",
      "panel_type": "unknown",
      "confidence": 0.0,
      "bubble_boxes": []
    },
    {
      "panel_index": 7,
      "y_start": 2312,
      "y_end": 2320,
      "narration": "",
      "dialogue": "",
      "panel_type": "unknown",
      "confidence": 0.0,
      "bubble_boxes": []
    },
    {
      "panel_index": 8,
      "y_start": 2320,
      "y_end": 2324,
      "narration": "",
      "dialogue": "",
      "panel_type": "unknown",
      "confidence": 0.0,
      "bubble_boxes": []
    },
    {
      "panel_index": 9,
      "y_start": 2324,
      "y_end": 2326,
      "narration": "",
      "dialogue": "",
      "panel_type": "unknown",
      "confidence": 0.0,
      "bubble_boxes": []
    },
    {
      "panel_index": 10,
      "y_start": 2326,
      "y_end": 3460,
      "narration": "",
      "dialogue": "",
      "panel_type": "unknown",
      "confidence": 0.0,
      "bubble_boxes": []
    },
    {
      "panel_index": 11,
      "y_start": 3460,
      "y_end": 4594,
      "narration": "",
      "dialogue": "",
      "panel_type": "unknown",
      "confidence": 0.0,
      "bubble_boxes": []
    },
    {
      "panel_index": 12,
      "y_start": 4594,
      "y_end": 5728,
      "narration": "",
      "dialogue": "",
      "panel_type": "unknown",
      "confidence": 0.0,
      "bubble_boxes": []
    },
    {
      "panel_index": 13,
      "y_start": 5728,
      "y_end": 6862,
      "narration": "",
      "dialogue": "",
      "panel_type": "unknown",
      "confidence": 0.0,
      "bubble_boxes": []
    },
    {
      "panel_index": 14,
      "y_start": 6862,
      "y_end": 6865,
      "narration": "",
      "dialogue": "",
      "panel_type": "unknown",
      "confidence": 0.0,
      "bubble_boxes": []
    },
    {
      "panel_index": 15,
      "y_start": 6865,
      "y_end": 6870,
      "narration": "",
      "dialogue": "",
      "panel_type": "unknown",
      "confidence": 0.0,
      "bubble_boxes": []
    },
    {
      "panel_index": 16,
      "y_start": 6870,
      "y_end": 6881,
      "narration": "",
      "dialogue": "",
      "panel_type": "unknown",
      "confidence": 0.0,
      "bubble_boxes": []
    },
    {
      "panel_index": 17,
      "y_start": 6881,
      "y_end": 6903,
      "narration": "",
      "dialogue": "",
      "panel_type": "unknown",
      "confidence": 0.0,
      "bubble_boxes": []
    },
    {
      "panel_index": 18,
      "y_start": 6903,
      "y_end": 6947,
      "narration": "",
      "dialogue": "",
      "panel_type": "unknown",
      "confidence": 0.0,
      "bubble_boxes": []
    },
    {
      "panel_index": 19,
      "y_start": 6947,
      "y_end": 7035,
      "narration": "",
      "dialogue": "",
      "panel_type": "unknown",
      "confidence": 0.0,
      "bubble_boxes": []
    },
    {
      "panel_index": 20,
      "y_start": 7035,
      "y_end": 7211,
      "narration": "",
      "dialogue": "",
      "panel_type": "unknown",
      "confidence": 0.0,
      "bubble_boxes": []
    },
    {
      "panel_index": 21,
      "y_start": 7211,
      "y_end": 8010,
      "narration": "",
      "dialogue": "",
      "panel_type": "unknown",
      "confidence": 0.0,
      "bubble_boxes": []
    }
  ]
}
