{
  "source": "strippng",
  "width": 800,
  "height": 4400,
  "model": "cloudflare",
  "config_hash": "d1526cd58b8fee012fac7007f9406b2c6a73f5fa9159021a151d418b727b5dfa",
  "input_hash": "6343832ce52cb860ec8fd6c3a41b9b2207e4b7560fe105ea290341e4a89a7f20",
  "provenance": "ai",
  "characters": [
    "John"
  ],
  "entries": [
    {
      "panel_index": 1,
      "y_start": 240,
      "y_end": 1040,
      "narration": "A character is standing in a room with a desk and a chair.",
      "dialogue": "What's going on?",
      "panel_type": "single",
      "confidence": 0.95,
      "bubble_boxes": [
        {
          "x": 400,
          "y": 800,
          "w": 800,
          "h": 600
        }
      ]
    },
    {
      "panel_index": 2,
      "y_start": 2040,
      "y_end": 2840,
      "narration": "John is standing in front of a desk with a chair behind him.",
      "dialogue": "",
      "panel_type": "single",
      "confidence": 0.95,
      "bubble_boxes": []
    },
    {
      "panel_index": 3,
      "y_start": 3696,
      "y_end": 4016,
      "narration": "John is standing in front of a desk with a chair behind him.",
      "dialogue": "",
      "panel_type": "single",
      "confidence": 0.95,
      "bubble_boxes": []
    }
  ]
}