{
  "source": "sample_strip.png",
  "width": 800,
  "height": 4400,
  "model": "gutter-fallback",
  "config_hash": "fallback",
  "input_hash": "fallback",
  "entries": [
    {
      "panel_index": 1,
      "y_start": 0,
      "y_end": 1107,
      "narration": "",
      "dialogue": "",
      "panel_type": "unknown",
      "confidence": 0.0,
      "bubble_boxes": []
    },
    {
      "panel_index": 2,
      "y_start": 1107,
      "y_end": 1907,
      "narration": "",
      "dialogue": "",
      "panel_type": "unknown",
      "confidence": 0.0,
      "bubble_boxes": []
    },
    {
      "panel_index": 3,
      "y_start": 1907,
      "y_end": 2807,
      "narration": "",
      "dialogue": "",
      "panel_type": "unknown",
      "confidence": 0.0,
      "bubble_boxes": []
    },
    {
      "panel_index": 4,
      "y_start": 2807,
      "y_end": 3707,
      "narration": "",
      "dialogue": "",
      "panel_type": "unknown",
      "confidence": 0.0,
      "bubble_boxes": []
    },
    {
      "panel_index": 5,
      "y_start": 3707,
      "y_end": 4400,
      "narration": "",
      "dialogue": "",
      "panel_type": "unknown",
      "confidence": 0.0,
      "bubble_boxes": []
    }
  ]
}
