{
  "source": "stripwebp",
  "width": 900,
  "height": 16000,
  "model": "cloudflare",
  "config_hash": "d1526cd58b8fee012fac7007f9406b2c6a73f5fa9159021a151d418b727b5dfa",
  "input_hash": "237aba35fca8376a7eee74dd35173302844b032091123513c4493ba9c6d135d9",
  "provenance": "ai",
  "characters": [
    "The Dragonslayer"
  ],
  "entries": [
    {
      "panel_index": 1,
      "y_start": 0,
      "y_end": 2040,
      "narration": "THIS BASTARD IS EVEN MORE DANGEROUS THAN THE DRAGONSLAYER.",
      "dialogue": "",
      "panel_type": "single",
      "confidence": 0.95,
      "bubble_boxes": []
    },
    {
      "panel_index": 2,
      "y_start": 2040,
      "y_end": 2840,
      "narration": "UNLIKE THAT GUY WHO LOST HIS MEMORIES, HE BEARS CLEAR HOSTILITY TOWARD 'BJORN.'",
      "dialogue": "",
      "panel_type": "single",
      "confidence": 0.95,
      "bubble_boxes": [
        {
          "x": 200,
          "y": 240,
          "w": 1800,
          "h": 800
        }
      ]
    },
    {
      "panel_index": 3,
      "y_start": 3840,
      "y_end": 4640,
      "narration": "IF I CAN'T TAKE HIM OUT THIS TIME, SOMEDAY HE'LL...",
      "dialogue": "...",
      "panel_type": "single",
      "confidence": 0.95,
      "bubble_boxes": []
    },
    {
      "panel_index": 4,
      "y_start": 5640,
      "y_end": 6440,
      "narration": "HE'LL HURT MY COMPANIONS.",
      "dialogue": "",
      "panel_type": "single",
      "confidence": 0.95,
      "bubble_boxes": []
    },
    {
      "panel_index": 5,
      "y_start": 7200,
      "y_end": 7440,
      "narration": "HE'LL HURT MY COMPANIONS",
      "dialogue": "The Dragonslayer",
      "panel_type": "single",
      "confidence": 0.95,
      "bubble_boxes": []
    },
    {
      "panel_index": 6,
      "y_start": 9240,
      "y_end": 10040,
      "narration": "A SUDDEN PRESSURE IN MY BRAIN... I'VE HIT MY LIMIT.",
      "dialogue": "",
      "panel_type": "single",
      "confidence": 0.95,
      "bubble_boxes": []
    },
    {
      "panel_index": 7,
      "y_start": 10800,
      "y_end": 11040,
      "narration": "I'VE HIT MY LIMIT.",
      "dialogue": "",
      "panel_type": "single",
      "confidence": 0.95,
      "bubble_boxes": []
    },
    {
      "panel_index": 8,
      "y_start": 11040,
      "y_end": 11840,
      "narration": "DAMN IT!",
      "dialogue": "I FELT LIKE I COULD'VE DONE IT WITH JUST A LITTLE MORE.",
      "panel_type": "single",
      "confidence": 0.95,
      "bubble_boxes": [
        {
          "x": 840,
          "y": 960,
          "w": 320,
          "h": 120
        }
      ]
    },
    {
      "panel_index": 9,
      "y_start": 12840,
      "y_end": 13640,
      "narration": "URRGH!",
      "dialogue": "...",
      "panel_type": "single",
      "confidence": 0.95,
      "bubble_boxes": [
        {
          "x": 840,
          "y": 960,
          "w": 320,
          "h": 120
        }
      ]
    },
    {
      "panel_index": 10,
      "y_start": 13640,
      "y_end": 14600,
      "narration": "BLEEERGH!",
      "dialogue": "",
      "panel_type": "single",
      "confidence": 0.95,
      "bubble_boxes": []
    },
    {
      "panel_index": 11,
      "y_start": 14592,
      "y_end": 15232,
      "narration": "COUGH, HACK... NGH...",
      "dialogue": "",
      "panel_type": "single",
      "confidence": 0.95,
      "bubble_boxes": [
        {
          "x": 672,
          "y": 768,
          "w": 256,
          "h": 96
        }
      ]
    }
  ]
}